Spinach Artichoke Ravioli Bake; Spinach Artichoke Ravioli Bake;|Servings: 10||22 ounces frozen ravioli||8 ounces of cream cheese||1½ cups mozzarella cheese||¾ cup sour cream||16 ounces (one can) artichoke hearts||5 ounces spinach, cooked and chopped||½ cup parmesan cheese||1 cup milk||1 tablespoon garlic salt (optional)|||;|1. In a large bowl, mix sour cream, parmesan cheese, mozzarella cheese, sour cream, artichoke hearts, spinach, milk, and garlic salt (if you want it). ||2. Pour a third of the spinach artichoke mixture in a large glass baking tray and spread it evenly over the bottom. ||3. Line the tray with frozen ravioli, spread more mixture over top the ravioli, then spread the rest of the ravioli in the tray and cover that with remaining mixture.||4. Bake in the oven at 375ºF/190ºC for 30–35 minutes or until the bake has browned.||5. Enjoy!|||;https://img.buzzfeed.com/buzzfeed-static/static/2016-07/11/16/asset/buzzfeed-prod-fastlane03/sub-buzz-17426-1468268314-1.jpg?resize=625:1309;https://img.youtube.com/vi/xP5t4hVTuSw/2.jpg;{"video": {"size": "big", "width":"625", "height":"376", "url":"https://youtube.com/watch?v=xP5t4hVTuSw", "id":"4311237_9217051", "length":"44", "published":"2016-07-11 16:27:01"}}
🍓Strawberry Banana Frozen Yogurt #TastyJunior🍌; Just imagine your little tike’s hands making this delightful treat with you:;|Servings: 4||3 cups frozen strawberries||3 frozen bananas||2/3 cup plain Greek yogurt||Chopped fresh strawberries (optional)|||;|1. Combine frozen fruit and yogurt in a food processor, blend until smooth.||2. Spread mixture onto an 8×8 glass baking dish, and sprinkle on fresh strawberries.||3. Cover and freeze for 2 hours.  ||4. Enjoy!|||;https://img.buzzfeed.com/buzzfeed-static/static/2016-06/29/16/asset/buzzfeed-prod-fastlane03/sub-buzz-14384-1467232849-4.jpg?resize=625:781;https://img.youtube.com/vi/pGJOGelvRmA/2.jpg;{"progload_video": {"size": "big", "width":"625", "height":"376", "url":"https://youtube.com/watch?v=pGJOGelvRmA", "id":"4297071_9072657", "length":"No image found", "published":"2016-06-29 16:48:58"}}
Loaded Mashed Potato Cups; Mix it up real good.;|Servings: 12||For the mashed potatoes: ||4 potatoes||¾ cup milk||4 Tbsp. Butter||¼ cup sour cream||For the cups: ||2 cups mashed potatoes||¼ cup bacon, cooked and crumbled||¼ cup chives||¼ cup Parmesan cheese, shredded||1 tsp salt||1 tsp pepper||1 tsp garlic powder||1 cup cheddar cheese|||;|In a large bowl, combine mashed potatoes, bacon, chives, Parmesan cheese, salt, pepper, and garlic powder. ||Spray a 12-cup muffin pan with cooking spray and divide the mashed potatoes evenly into each cup, ||Make a hole in the center of each mashed potato cup.||Add shredded cheddar to the center of each cup. ||Bake mashed potato cups at 400ºF/200ºC for 30-35 minutes or until outside is crispy and brown. ||Top with a dollop of sour cream, chives, and bacon crumbs. Enjoy!|||;https://img.buzzfeed.com/buzzfeed-static/static/2016-06/15/19/asset/buzzfeed-prod-fastlane03/sub-buzz-5937-1466032717-1.jpg?resize=625:875;https://img.youtube.com/vi/kF6rT4v9nQY/2.jpg;{"progload_video": {"size": "big", "width":"625", "height":"376", "url":"https://youtube.com/watch?v=kF6rT4v9nQY", "id":"4279790_8911332", "length":"", "published":"2016-06-17 11:29:33"}}
Cheese Stuffed Cauliflower Nuggets; Cheese-Stuffed Cauliflower Nuggets;|Servings: 12 nuggets||1 head of cauliflower, steamed||1 egg||¾ cup bread crumbs||½ teaspoon salt||¼ teaspoon pepper||1 teaspoon garlic powder||2 tablespoons dried parsley||12 (1-inch) cubes cheddar cheese||1 cup flour||2 eggs, beaten||1 cup bread crumbs|||;|1. Preheat oven to 350°F/180°C.||2. In a bowl, mash the cauliflower until slightly combined. ||3. Add the egg, ¾ cup bread crumbs, salt, pepper, garlic powder, and parsley, and mix with a fork until combined.  Chill for 10 minutes.||4. Form the mixture into nuggets with a cube of cheddar cheese in the center.  Pack them tightly.||5. Roll each nugget in flour, then egg, then bread crumbs.  Place on a baking sheet covered in parchment paper.||6. Bake for 18-20 minutes, flipping the nuggets halfway through.  Brush with oil for browner nuggets.||7. Enjoy!|||;https://img.buzzfeed.com/buzzfeed-static/static/2016-05/25/16/asset/buzzfeed-prod-fastlane03/sub-buzz-1435-1464207201-19.jpg?resize=625:781;https://img.youtube.com/vi/db8h8VuN388/2.jpg;{"video": {"size": "big", "width":"625", "height":"376", "url":"https://youtube.com/watch?v=db8h8VuN388", "id":"4259155_8729421", "length":"58", "published":"2016-05-25 16:32:38"}}
Waffle Grilled Cheese; Waffle Grilled Cheese;|Makes 4 sandwiches||2 cups waffle mix||1 Tbsp. minced rosemary (fresh or dried)||1 egg||2 Tbsp. vegetable oil||1 1/3 cup milk||8 oz sliced sharp cheddar cheese|||;|1. In a large bowl, combine waffle mix, rosemary, egg, oil, and milk. Stir until well combined.||2. Pour about 1/2 cup of the batter into the waffle iron (Amount may vary based on the size of the waffle iron). Cook until the waffle is golden brown.||3. Add slices of cheese on half of the waffle. Carefully, fold the other half on top and close the lid. Cook until the cheese is melted.||4. Serve & enjoy!|||;https://img.buzzfeed.com/buzzfeed-static/static/2016-04/29/17/enhanced/webdr12/enhanced-15362-1461965954-12.jpg;https://img.youtube.com/vi/FGE7buYaQfg/2.jpg;{"video": {"size": "big", "width":"625", "height":"376", "url":"https://youtube.com/watch?v=FGE7buYaQfg", "id":"4234519_8560422", "length":"No image found", "published":"2016-04-29 17:43:18"}}
Berry Smoothie Bowl; Berry Smoothie Bowl;|Servings: 2||2 cups mixed berries (we used 1/2 cup strawberries, 1/2 cup raspberries, 1 cup blackberries)||1/2 cup greek yogurt||1/4 cup almond milk (or soy milk)||1/4 cup peanut butter||Top with whatever you like! ||We used: ||Sliced strawberries||Sliced bananas||Slivered almonds||Sunflower seeds||Shredded coconut||Chia seeds|||;|1. Blend mixed berries, greek yogurt, almond milk, and peanut butter until smooth.||2. Top with your favorite toppings and enjoy!|||;https://img.buzzfeed.com/buzzfeed-static/static/2016-04/22/17/enhanced/webdr10/enhanced-4867-1461358987-10.jpg;https://img.youtube.com/vi/b37XaK4m58w/2.jpg;{"video": {"size": "big", "width":"625", "height":"376", "url":"https://youtube.com/watch?v=b37XaK4m58w", "id":"4226756_8508161", "length":"44", "published":"2016-04-23 15:20:12"}}
Buffalo Cauliflower Tacos; Cauliflower can be so versatile.;|Servings: 6-8 tacos||For the cauliflower:||1 head of cauliflower||2 tsp garlic powder||1 tsp salt||1/4 cup hot sauce||2 tablespoons butter, melted||For the tacos (mostly optional, but recommended):||10 flour tortillas or 1 head butter leaf lettuce (or both, go crazy!)||1/2 cup halved cherry tomatoes ||1 avocado, cubed||1/4 cup blue cheese or ranch dressing|||;|1. Preheat oven to 425ºF / 218ºC.||2. Cut the head of cauliflower in half. Using your hands, pluck bite sized florets from each half. Trim bottoms of florets as necessary.||3. Toss the cauliflower in a large bowl with the garlic powder, salt, hot sauce, and melted butter.||4. Spread cauliflower on a baking in a single layer and roast for 40 minutes, mixing after 20.||5. Assemble your tacos with your preferred toppings and shell and eat.|||;https://img.buzzfeed.com/buzzfeed-static/static/2016-05/3/12/enhanced/webdr04/enhanced-26102-1462293746-1.jpg;https://img.youtube.com/vi/OJBxIU_qGtw/2.jpg;{"progload_video": {"size": "big", "width":"625", "height":"376", "url":"https://youtube.com/watch?v=OJBxIU_qGtw", "id":"4237539_8580305", "length":"54", "published":"2016-05-03 12:56:54"}}
Red Wine Spaghetti; Here’s what happiness in a bowl looks like:;|Servings: 4||4 cups water||1 bottle full bodied red wine (we used cabernet) ||1 pound spaghetti ||2 tablespoons olive oil||4 cloves garlic, thinly sliced||1 teaspoon red pepper flakes||2 tablespoons butter||1 cup freshly grated parmesan||1/2 cup flatleaf Italian parsley|||;|1. Measure 1/4 cup of wine and set aside.||2. Combine the water and the remainder of the bottle of wine (about 3 cups) in a large pot and bring to a boil. ||3. Once boiling, add spaghetti and cook (stirring frequently) until al dente, about 7 minutes. ||4. Reserve 1/4 cup of the cooking liquid and drain the spaghetti. Set aside.||5. In a large skillet, heat the olive oil on medium heat. Add the garlic and red pepper flakes and cook for 2 minutes, stirring occasionally.||6. Add the reserved cooking liquid and 1/4 cup of reserved wine to the skillet and bring to a simmer. Add the pasta and toss to coat with the sauce.||7. Add the butter and stir until it melts into the pasta.||8. Add salt and pepper, parmesan, and parsley and stir to combine. ||9. Serve on its own or top with more parmesan and parsley and open up another bottle of wine!|||;https://img.buzzfeed.com/buzzfeed-static/static/2016-05/6/13/enhanced/webdr10/enhanced-6688-1462554846-11.jpg;https://img.youtube.com/vi/aPp0aJcB81k/2.jpg;{"progload_video": {"size": "big", "width":"625", "height":"376", "url":"https://youtube.com/watch?v=aPp0aJcB81k", "id":"4241093_8606064", "length":"81", "published":"2016-05-06 13:50:33"}}
Sweet Potato Black Bean Hash; This super-healthy breakfast will totally be a hit this weekend.;|Yields: 4 servings||||4 Tbsp. olive oil||3 cups diced sweet potatoes (about 2 large potatoes)||½ yellow onion, diced||1 red pepper, sliced||Salt and pepper to taste||½ Tbsp. paprika||1 tsp cumin||2 cups spinach||1 15-oz. can black beans|||||;|Heat olive oil on medium heat in a large pan. Add sweet potatoes, onion, pepper, salt, pepper, paprika, and cumin and stir. Cook for 10 minutes, occasionally stirring. Add spinach and cook for an additional five minutes. Lastly, add the black beans and stir until all ingredients are well-blended.||Serve up with eggs and avocado or on its own. Enjoy!|||;https://img.buzzfeed.com/buzzfeed-static/static/2016-02/16/15/enhanced/webdr03/enhanced-27812-1455652882-9.jpg;https://img.youtube.com/vi/XgmgpUIzU7M/2.jpg;{"video": {"size": "big", "width":"625", "height":"376", "url":"https://youtube.com/watch?v=XgmgpUIzU7M", "id":"4157864_8014227", "length":"46", "published":"2016-02-19 13:26:38"}}
Strawberry Peach Sangria; Strawberry Peach Sangria;|Serves 8 - 10||15 strawberries||2 peaches ||2 cups water||1½ cups sugar||1 bottle white wine, chilled||¾ cup rum||Extra strawberries and peaches, sliced||1 bottle sparkling white wine or champagne, chilled||Ice cubes|||;|1. Discard the green tops of the strawberries and slice the peaches. ||2. In a saucepan, dissolve sugar in water, then add the strawberries and peaches. ||3. Bring to a rolling boil and reduce to medium heat. Boil for approximately 15 minutes, or until the strawberries become pale and the peaches are soft. ||4. Strain the syrup and refrigerate for 2 hours, or until cooled. Discard boiled fruit. ||5. In a pitcher, combine the cooled syrup, sliced fruit, white wine, and rum. ||6. Scoop fruit into glasses with ice, pour sangria, and top with sparkling wine.||7. Enjoy!|||;https://img.buzzfeed.com/buzzfeed-static/static/2016-09/6/18/asset/buzzfeed-prod-fastlane03/sub-buzz-21976-1473202507-14.jpg?resize=625:781;https://img.youtube.com/vi/D9xrihRbNbk/2.jpg;{"video": {"size": "big", "width":"625", "height":"376", "url":"https://youtube.com/watch?v=D9xrihRbNbk", "id":"4350578_9590951", "length":"No image found", "published":"2016-09-09 14:13:30"}}
Berry Vodka Sunrise #TastyHappyHour; Berry Vodka Sunrise;|Yield: 10 servings||3 cups vodka||3 cups orange juice ||3 cups sparkling water ||1 ½ cups mixed berries||1 ½ cups tart cherry juice||1 ½ cups maraschino cherry liquid (¼ cup grenadine will work as a substitute)||Fresh orange slices and maraschino cherries to garnish|||;|1. Combine vodka, orange juice, and sparkling water in a pitcher.||2. Stir in the fresh oranges and set aside. ||3. Puree mixed berries, tart cherry juice, and maraschino cherry liquid in a blender or food processor.||4. Strain the purée through a sieve into a separate pitcher. ||5. When ready to serve, pour orange vodka mixture into a glass of ice, leaving some room. ||6. Top off the drink with the berry liquid and watch it settle to the bottom. ||7. Garnish with an orange and maraschino cherry. ||Recipe by Jessica Maroney|||;https://img.buzzfeed.com/buzzfeed-static/static/2016-08/11/12/asset/buzzfeed-prod-fastlane01/sub-buzz-10614-1470932326-1.jpg?resize=625:781;https://img.youtube.com/vi/QgmGeDcnzl4/2.jpg;{"video": {"size": "big", "width":"625", "height":"376", "url":"https://youtube.com/watch?v=QgmGeDcnzl4", "id":"4333084_9416797", "length":"58", "published":"2016-08-11 12:29:27"}}
Mango Kiwi Pineapple Sangria 🍹;Mango Kiwi Pineapple Sangria;|Servings: 6||3 small mangos, diced||3 kiwis, peeled and sliced||1 cup coconut rum||750 milliliters white wine||2 cups pineapple juice||1 cup soda water|||;|1. In a pitcher, pour the coconut rum over the mango and kiwi.  Chill for one hour.||2. Pour in the rest of the ingredients and stir.||3. Enjoy!|||;https://img.buzzfeed.com/buzzfeed-static/static/2016-07/29/14/asset/buzzfeed-prod-fastlane02/sub-buzz-11708-1469818426-1.jpg?resize=625:781;https://img.youtube.com/vi/VXISJ-PBxmE/2.jpg;{"video": {"size": "big", "width":"625", "height":"376", "url":"https://youtube.com/watch?v=VXISJ-PBxmE", "id":"4324190_9339622", "length":"57", "published":"2016-07-29 15:00:19"}}
Boozy Orange And Vanilla Milkshake ‪#‎TastyHappyHour‬ 🍊; Boozy Orange And Vanilla Milkshake;|1 orange, cut into slices for garnish||8 scoops vanilla ice cream||1 can frozen orange juice concentrate||½ cup vanilla-flavored vodka||¼ cup orange liqueur|||;|1. Cut the orange into slices and set aside for garnish.||2. In a blender, add 4 scoops of ice cream, orange juice concentrate, vodka, and orange liqueur. Blend until well-combined.||3. Add the remaining 4 scoops of ice cream and blend.||4. Pour into a glass and garnish with an orange slice.||5. Serve & enjoy!|||;https://img.buzzfeed.com/buzzfeed-static/static/2016-07/22/16/asset/buzzfeed-prod-fastlane01/sub-buzz-5352-1469218197-1.jpg?resize=625:781;https://img.youtube.com/vi/CVuGZzxwTTM/2.jpg;{"video": {"size": "big", "width":"625", "height":"376", "url":"https://youtube.com/watch?v=CVuGZzxwTTM", "id":"4319344_9293404", "length":"No image found", "published":"2016-07-22 16:07:46"}}
Sangria 4 Ways 🍹; Your friends at ;|Ingredients||2 lbs strawberries, sliced||1 lemon, sliced||1 bottle white wine||1 cup white rum||4 cups lemonade||2 cups champagne||Lemon slices for garnish||Preparation:||In a large pitcher, combine the strawberries, lemon, wine, rum, and lemonade. Stir until mixed. Chill for at least 4 hours. Add the champagne, then serve with a lemon slice on each glass!||Mixed Berry Sangria||Servings: 6-8||Ingredients||1 cup blackberries||1 cup strawberries, sliced||1 cup blueberries||1 bottle red wine||1 cup brandy||3 cups apple juice||2 cups lemon-lime soda||Strawberries for garnish||Preparation:||In a large pitcher, combine the blackberries, strawberries, blueberries, red wine, brandy, and apple juice.||Stir until mixed.||Chill for at least 4 hours.||Add the lemon-lime soda, then serve with a strawberry on each glass!||Mango Pineapple Sangria||Servings: 6-8||Ingredients||2 cups pineapple, diced||3 mangos, diced||1 bottle red wine||1 cup brandy||3 cups pineapple juice||2 cups orange soda||Pineapple wedges for garnish||Preparation:||In a large pitcher, combine the pineapples, mangoes, wine, brandy, and pineapple juice. Stir until mixed. Chill for at least 4 hours. Add the soda, then serve with a pineapple wedge on each glass!||Raspberry Peach Sangria||Servings: 6-8||Ingredients:||3 white peaches, sliced||2 cups raspberries||1 bottle rosé||1 cup white rum||4 cups peach nectar||1 cup champagne||Peach slices for garnish||Preparation:||In a large pitcher, combine the peaches, raspberries, rosé, rum, and peach nectar. Stir until mixed. Chill for at least 4 hours. Add the champagne, then serve with a peach slice on each glass!|||;|Ingredients:||2 lbs sirloin steak, cut into 1-inch cubes||1 Tbsp. cumin||1 Tbsp. chili powder||1 Tbsp. garlic powder||1 tsp salt||1 tsp pepper||2 green bell peppers, cut into 1-inch pieces||2 red bell peppers, cut into 1-inch pieces||1 large white onion, cut into 1-inch pieces||8-10 bamboo skewers, soaked in water for 20 minutes||Instructions:||Preheat grill to medium-high heat. Combine the steak, cumin, chili powder, garlic powder, salt, and pepper in a bowl, mixing until the steak is evenly coated. Slide a piece of steak down the skewer, followed by pieces of green pepper, red pepper, and onion. Repeat until there is a 1-inch gap on the top of the skewer. Repeat with the remaining skewers.||Grease the surface of the grill by rubbing the grates with a tongs and an oiled paper towel. Grill the skewers for about 10-15 minutes with the lid closed, flipping them halfway. Serve!||Roasted Veggie Skewers||Servings: 8-10||Ingredients:||¼ cup olive oil||2 Tbsp. lemon juice||1 Tbsp. dried oregano||1 tsp salt||1 tsp pepper||2 zucchinis, sliced into rounds||3 cups cremini mushrooms||2 medium red onions, cut into 1-inch pieces||2 red bell peppers, cut into 1-inch pieces||2 yellow bell peppers, cut into 1-inch pieces||4-5 bamboo skewers, soaked in water for 20 minutes||Instructions:||Preheat grill to medium heat. Combine the oil, lemon juice, oregano, salt, and pepper, stirring until mixed. Slide a zucchini slice down the skewer, followed by pieces of mushroom, red onion, and peppers, repeating until there is a 1-inch gap at the top of the skewer. Repeat with the remaining skewers and vegetables. Brush each skewer liberally with the oil mixture. Grill the skewers for 12-18 minutes with the lid closed, flipping halfway. Serve!||Teriyaki Chicken Skewers||Servings: 4-5||Ingredients:||1 lb boneless, skinless chicken thighs, cut into 1-inch cubes||1 cup soy sauce||¾ cup brown sugar||1 Tbsp. sesame seeds||¼ cup green onions, chopped||1 pineapple, diced into 1-inch cubes||4-5 bamboo skewers, soaked in water for 20 minutes||Instructions:||Preheat grill to medium heat. Combine the chicken, soy sauce, brown sugar, sesame seeds, and green onions, stirring until evenly coated. Chill and marinate for at least 2 hours.||Slide a piece of chicken down the skewer, alternating between chicken and pineapple, until there is a 1-inch gap on the top of the skewer. Repeat with the remaining chicken, pineapple, and skewers. ||Grease the surface of the grill by rubbing the grates with a tongs and an oiled paper towel. Grill the skewers for about 12-18 minutes with the lid closed, flipping them halfway. Brush the skewers with the leftover marinade during grilling, if desired. Serve!||BBQ Chicken Bacon Skewers||Servings: 4-5||Ingredients:||1 lb boneless, skinless, chicken thighs, cut into 1-inch cubes||1 cup BBQ sauce||1 tsp salt||1 tsp pepper||4-5 bacon strips||4-5 bamboo skewers, soaked in water for 20 minutes||Preparation:||Preheat grill to medium heat. Combine the chicken, BBQ sauce, salt, and pepper, stirring until evenly mixed. Thread one end of the bacon onto the end of a skewer. Add a piece of chicken, and weave the bacon around the chicken and back through the skewer, creating a wave pattern between the chicken. Move the bacon and the chicken down the skewer, repeating until the other edge of the bacon is threaded through. Repeat with the remaining chicken, bacon, and skewers.||Grease the surface of the grill by rubbing the grates with a tongs and an oiled paper towel. Grill the skewers for about 12-18 minutes with the lid closed, flipping them halfway. Serve!|||;https://img.buzzfeed.com/buzzfeed-static/static/2016-06/24/13/asset/buzzfeed-prod-fastlane03/sub-buzz-12069-1466787918-1.jpg?resize=625:893;https://img.youtube.com/vi/l_xi6G1epnI/2.jpg;{"progload_video": {"size": "big", "width":"625", "height":"376", "url":"https://youtube.com/watch?v=l_xi6G1epnI", "id":"4279766_9004343", "length":"103", "published":"2016-06-24 13:11:45"}}
Peach Iced Tea Whiskey #TastyHappyHour; Peach Iced Tea Whiskey;|Tea:||8 cups boiling water||7-8 black tea bags||1 1/2 cups whiskey||Peach Simple Syrup:||2-3 fresh peaches, diced||1 cup sugar||1 cup water||1 lemon, juiced||Garnish:||1-2 peaches, sliced||1 lemon, sliced||Mint sprigs|||;|1. In a large pitcher, pour hot water over tea bags, letting steep 5 minutes. ||2. Bring syrup ingredients to boil, then reduce heat to medium.||3. Strain syrup through a fine strainer to remove fruit pieces.||4. Add syrup and whiskey to tea, then chill until ready to serve.||5. Serve over ice, with sliced peaches, sliced lemons, and a mint sprig.|||;https://img.buzzfeed.com/buzzfeed-static/static/2016-05/13/14/enhanced/webdr09/enhanced-32695-1463163023-1.jpg;https://img.youtube.com/vi/xBS1Meygeus/2.jpg;{"video": {"size": "big", "width":"625", "height":"376", "url":"https://youtube.com/watch?v=xBS1Meygeus", "id":"4247798_8652605", "length":"52", "published":"2016-05-13 14:14:55"}}
Cherry Moscow Mule; Cherry Moscow Mule;|Servings: 1 drink||6 maraschino cherries||1 ounce lime juice||3 ounce vodka||6 ounce ginger beer||Edible flowers, to garnish|||;|1. In a glass, muddle maraschino cherries and lime juice.||2. Add vodka and stir.||3. In a copper mug, pour cherry mixture over ice and top it off with ginger beer.||4. Add edible flowers for garnish||5. Serve & enjoy!|||;https://img.buzzfeed.com/buzzfeed-static/static/2016-05/27/10/asset/buzzfeed-prod-fastlane01/sub-buzz-533-1464359285-1.jpg?resize=625:781;https://img.youtube.com/vi/YyFzL6Gg66s/2.jpg;{"video": {"size": "big", "width":"625", "height":"376", "url":"https://youtube.com/watch?v=YyFzL6Gg66s", "id":"4261186_8744424", "length":"", "published":"2016-05-27 12:07:55"}}
🍓 Strawberry Cotton Candy Cocktail 🍓; HOUDINI HAS ARRIVED TO TASTY…;|4 strawberries||2 1-ounce bags cotton candy ||2 limes||⅓ cup vodka||⅔ cup rosé wine||⅔ cup champagne|||;|Make four to five cuts along the length of the strawberry, starting from the pointed end until just before the stem end. Fan the slices apart with your fingers, and set aside.||Separate the cotton candy into two balls. Cut a slit in the center and push the fanned strawberry inside, sealing up the hole afterwards.||Slice half of the lime into rounds, saving the other half for later. Make a single cut on each lime slice, starting from the center and cutting through the rind.||In a large pitcher or jug, mix the vodka and rose. Squeeze the juice from reserved lime half into the mixture, then add champagne.||Place the strawberry-stuffed cotton candy balls into two separate martini glasses. ||Place the lime slices on the side of the glass.||Pour the drink mixture around the sides of the cotton candy in a circular motion, and watch it dissolve to reveal the strawberry inside!|||;https://img.buzzfeed.com/buzzfeed-static/static/2016-04/29/16/enhanced/webdr08/enhanced-10664-1461960086-5.jpg;https://img.youtube.com/vi/b9SWrIuex-M/2.jpg;{"progload_video": {"size": "big", "width":"625", "height":"376", "url":"https://youtube.com/watch?v=b9SWrIuex-M", "id":"4234440_8559535", "length":"52", "published":"2016-04-29 16:24:43"}}
Boozy Bubbly Sherbet Punch ‪#‎TastyHappyHour‬; Boozy Sherbet Punch;|Rainbow sherbet||Fresh raspberries ||6 oz (half can) fruit punch concentrate, thawed||6 oz (half can) pink/raspberry lemonade concentrate, thawed||1 cup vodka ||5 cups ginger ale, chilled||1 bottle champagne, chilled||Fresh mint (optional)|||;|Using cupcake liners in a muffin tin, fill each with four to five raspberries and top with a scoop of rainbow sherbet. Freeze until ready to serve (best if frozen for at least two hours).||In a large pitcher, mix together the juice concentrates, raspberries, and vodka. Just before serving, mix in the ginger ale. ||To serve: Remove a sherbet scoop from the cupcake liner and place in a large mug. Fill halfway with punch and finish with champagne. Garnish with fresh mint. Enjoy!|||;https://img.buzzfeed.com/buzzfeed-static/static/2016-04/1/19/enhanced/webdr11/enhanced-3946-1459552158-2.jpg;https://img.youtube.com/vi/J-Jhx2sjQiA/2.jpg;{"video": {"size": "big", "width":"625", "height":"376", "url":"https://youtube.com/watch?v=J-Jhx2sjQiA", "id":"4198697_8351542", "length":"53", "published":"2016-04-01 19:17:13"}}
Butterscotch Shot Glasses #TastyHappyHour; Shot glasses perfect for your evening cocktail, yes indeed!;|Yields: 1 shot glass||7 hard candies (We used butterscotch.)|||;|Preheat the oven to 300˚F/150˚C. ||Cut parchment paper into a 5×5 square and place on a baking sheet. Arrange candies into a circle with one candy in the middle. Bake for about five minutes, or until the candies have melted into one molten piece. Slide parchment paper and molten candy from the baking tray to a cold counter top and let it cool for 30-45 seconds. CAREFULLY (will still be very hot) and quickly peel the paper off and place the center of the candy on an upside down shot glass. Push the sides of the candy down around the glass quickly with your fingers and let it harden and cool to room temperature. Make sure that whatever liquid you are pouring and the candy shot glass are the same temperature, or else the candy will crack.|||;https://img.buzzfeed.com/buzzfeed-static/static/2016-03/17/19/enhanced/webdr14/enhanced-2189-1458258817-1.jpg;https://img.youtube.com/vi/iKCOCGnFUCo/2.jpg;{"video": {"size": "big", "width":"625", "height":"376", "url":"https://youtube.com/watch?v=iKCOCGnFUCo", "id":"4185922_8246258", "length":"29", "published":"2016-03-17 20:04:36"}}
